{
  "$schema": "https://json-schema.org/draft/2020-12/schema",
  "$id": "urn:unclaimed-platform:schema:property-type-diagnostic-remediation-evidence-proposal:1.0.0",
  "title": "PropertyTypeDiagnosticRemediationEvidenceProposal",
  "type": "object",
  "additionalProperties": false,
  "required": [
    "schema_version",
    "proposal_id",
    "proposal_version",
    "proposal_status",
    "prepared_on",
    "jurisdiction",
    "source_id",
    "source_segment_id",
    "base_state",
    "established_facts",
    "diagnostic_question",
    "future_diagnostic_scope_if_later_authorized",
    "diagnostic_derivation_boundary_if_later_authorized",
    "diagnostic_classes",
    "diagnostic_output_contract_if_later_authorized",
    "remediation_decision_map",
    "parser_boundary",
    "consumed_authorizations",
    "authorization_boundary",
    "forbidden_actions",
    "implementation_state",
    "safety_state",
    "acceptance_criteria",
    "next_gate"
  ],
  "properties": {
    "schema_version": {"const": "1.0.0"},
    "proposal_id": {"const": "ca.sco.segment_500_plus.property_type_diagnostic_remediation_evidence"},
    "proposal_version": {"const": "1.0.0"},
    "proposal_status": {"const": "PROPOSAL_ONLY_NOT_AUTHORIZED"},
    "prepared_on": {"type": "string", "format": "date", "const": "2026-09-15"},
    "jurisdiction": {"const": "CA"},
    "source_id": {"const": "ca.sco.unclaimed_property.bulk"},
    "source_segment_id": {"const": "ca.sco.unclaimed_property.bulk.500_plus"},
    "base_state": {
      "const": {
        "branch": "m3-ca-sco-property-type-authority-archive-provenance-review",
        "head_sha": "961d6a908dd9656f5ce19823be074011010833bf",
        "head_ci_run": "35014204079",
        "authority_review_package_sha": "0b08163c624165fed4394e74265363fab53b2f5a",
        "authority_review_ci": "35013841037",
        "authority_review_decision": "ARCHIVED_AUTHORITY_RESOLVES_TARGET_PROVENANCE_SOURCE_SEMANTIC_MISMATCH_REMAINS",
        "authority_review_evidence": "sources/evidence/ca_sco_segment_500_plus.property_type_authority_archive_provenance.review.v1.json",
        "second_execution_run_id": "34995672539",
        "second_execution_schema_version": "1.1.0",
        "second_execution_result": "STOPPED_FAIL_CLOSED",
        "second_execution_stop_reason": "PROPERTY_TYPE_FORMAT_UNEXPECTED",
        "second_execution_evidence": "sources/evidence/ca_sco_segment_500_plus.property_type_semantic.execution.v1_1.second.json"
      }
    },
    "established_facts": {
      "const": [
        "THE_V1_1_RUNNER_ALREADY_SEPARATES_UTF8_ENCODING_FAILURE_FROM_DECODED_FORMAT_MISMATCH",
        "THE_SECOND_REAL_RUN_REACHED_A_DECODED_NON_EMPTY_PROPERTY_TYPE_THAT_FAILED_THE_UNCHANGED_SHAPE_REGEX",
        "THE_EXACT_OFFENDING_VALUE_BYTES_HASH_LENGTH_AND_FRAGMENTS_WERE_NOT_RETAINED_AND_MUST_NOT_BE_RECONSTRUCTED_OR_INFERRED",
        "THE_ARCHIVED_AUTHORITY_DOES_NOT_CONTRADICT_THE_CURRENT_SHAPE_REGEX",
        "THE_ARCHIVED_AUTHORITY_CONFIRMS_ZZZZ_AND_THE_CALIFORNIA_INSURANCE_CODE_SET",
        "NO_CURRENT_EVIDENCE_AUTHORIZES_TRIMMING_UPPERCASING_NORMALIZATION_REGEX_RELAXATION_OR_PARSER_CHANGE"
      ]
    },
    "diagnostic_question": {
      "const": "If a future separately authorized bounded source execution reproduces the decoded non-empty PROPERTY_TYPE format mismatch, which coarse non-value-bearing diagnostic class best explains the mismatch without retaining or reconstructing the source value?"
    },
    "future_diagnostic_scope_if_later_authorized": {
      "const": {
        "source_network_access_authorized_by_this_proposal": false,
        "exact_endpoint": "https://claimit.ca.gov/upd-property-records/04_From_500_To_Beyond.zip",
        "expected_content_length": 162416884,
        "expected_etag": "\"b25b315b6cd8007624387c3a00d4b1fe\"",
        "expected_media_type": "application/zip",
        "expected_accept_ranges": "bytes",
        "canonical_member": "From_500_To_Beyond_1_of_4.csv",
        "canonical_member_local_header_offset": 0,
        "members_max": 1,
        "transient_data_rows_max": 4,
        "stop_at_first_reproduced_format_mismatch": true,
        "head_requests_max": 1,
        "range_requests_max": 1,
        "http_requests_max_total": 2,
        "range_response_bytes_max_each": 131072,
        "source_response_body_bytes_max_total": 131072,
        "uncompressed_transient_bytes_max_total": 262144,
        "logical_record_bytes_max": 32768,
        "retries_max": 0,
        "redirects_allowed": false,
        "additional_range_allowed": false,
        "full_body_fallback_allowed": false,
        "automatic_widening_allowed": false,
        "source_identity_drift_behavior": "STOP_FAIL_CLOSED",
        "mismatch_not_reproduced_within_bound_behavior": "STOP_FAIL_CLOSED",
        "authority_network_access_allowed": false,
        "other_source_or_endpoint_access_allowed": false
      }
    },
    "diagnostic_derivation_boundary_if_later_authorized": {
      "const": {
        "purpose": "DERIVE_ONE_COARSE_DIAGNOSTIC_CLASS_FROM_THE_FIRST_REPRODUCED_FORMAT_MISMATCH_ONLY",
        "current_regex": "^(?:[A-Z]{2}[0-9]{2}|ZZZZ)$",
        "allowed_in_memory_probes": [
          "SURROUNDING_ASCII_SPACE_OR_TAB_REMOVAL_MATCH_PREDICATE",
          "ASCII_UPPERCASE_MATCH_PREDICATE",
          "COMBINED_SURROUNDING_ASCII_SPACE_OR_TAB_REMOVAL_AND_ASCII_UPPERCASE_MATCH_PREDICATE",
          "NON_ASCII_OR_DISALLOWED_CONTROL_PRESENCE_PREDICATE"
        ],
        "unicode_normalization_probe_allowed": false,
        "stdlib_full_row_parser_crosscheck_allowed": false,
        "custom_parser_change_allowed": false,
        "regex_change_allowed": false,
        "regex_relaxation_allowed": false,
        "source_value_acceptance_after_probe_allowed": false,
        "remediation_application_during_diagnostic_allowed": false,
        "persist_exact_property_type": false,
        "persist_property_type_bytes": false,
        "persist_property_type_hash": false,
        "persist_property_type_exact_length": false,
        "persist_property_type_fragments": false,
        "persist_property_type_codepoints": false,
        "persist_transformed_property_type": false,
        "persist_full_row": false,
        "persist_raw_response_body": false,
        "persist_property_id": false,
        "persist_owner_holder_values": false,
        "record_source_values_in_logs": false
      }
    },
    "diagnostic_classes": {
      "const": [
        {
          "class_id": "SURROUNDING_ASCII_WHITESPACE_ONLY",
          "definition": "The original decoded non-empty value fails the current regex, but removing only leading/trailing ASCII space U+0020 or tab U+0009 makes it match.",
          "automatic_remediation": false
        },
        {
          "class_id": "ASCII_CASE_ONLY",
          "definition": "The original decoded non-empty value fails the current regex, but ASCII-only uppercasing without trimming makes it match.",
          "automatic_remediation": false
        },
        {
          "class_id": "SURROUNDING_ASCII_WHITESPACE_AND_CASE",
          "definition": "Neither the whitespace-only nor case-only probe matches, but applying both bounded diagnostic predicates makes the value match the current regex.",
          "automatic_remediation": false
        },
        {
          "class_id": "NON_ASCII_OR_CONTROL_CONTENT",
          "definition": "The decoded value contains a non-ASCII code point or a disallowed ASCII control character and is not classified by an earlier bounded predicate.",
          "automatic_remediation": false
        },
        {
          "class_id": "ASCII_STRUCTURAL_MISMATCH",
          "definition": "The decoded value is ASCII, is not explained by the bounded whitespace/case predicates, and still fails the current regex.",
          "automatic_remediation": false
        }
      ]
    },
    "diagnostic_output_contract_if_later_authorized": {
      "const": {
        "allowed_persisted_fields": [
          "diagnostic_result_status",
          "diagnostic_class",
          "source_identity_verified",
          "head_requests",
          "range_requests",
          "http_requests_total",
          "source_response_body_bytes_read",
          "transient_rows_examined",
          "safety_flags"
        ],
        "diagnostic_result_status_values": ["DIAGNOSTIC_CLASSIFIED", "STOPPED_FAIL_CLOSED"],
        "diagnostic_class_values": [
          "SURROUNDING_ASCII_WHITESPACE_ONLY",
          "ASCII_CASE_ONLY",
          "SURROUNDING_ASCII_WHITESPACE_AND_CASE",
          "NON_ASCII_OR_CONTROL_CONTENT",
          "ASCII_STRUCTURAL_MISMATCH"
        ],
        "free_text_source_derived_output_allowed": false,
        "per_row_value_output_allowed": false,
        "distinct_property_type_code_output_allowed": false,
        "transformed_value_output_allowed": false
      }
    },
    "remediation_decision_map": {
      "const": [
        {
          "diagnostic_class": "SURROUNDING_ASCII_WHITESPACE_ONLY",
          "possible_later_action": "CONSIDER_SEPARATE_TRIM_POLICY_REMEDIATION_PROPOSAL",
          "authorized_by_this_proposal": false
        },
        {
          "diagnostic_class": "ASCII_CASE_ONLY",
          "possible_later_action": "CONSIDER_SEPARATE_CASE_POLICY_REMEDIATION_PROPOSAL",
          "authorized_by_this_proposal": false
        },
        {
          "diagnostic_class": "SURROUNDING_ASCII_WHITESPACE_AND_CASE",
          "possible_later_action": "CONSIDER_SEPARATE_TRIM_AND_CASE_POLICY_REMEDIATION_PROPOSAL",
          "authorized_by_this_proposal": false
        },
        {
          "diagnostic_class": "NON_ASCII_OR_CONTROL_CONTENT",
          "possible_later_action": "REQUIRE_SEPARATE_SOURCE_FORMAT_OR_PARSER_DIAGNOSTIC_PROPOSAL",
          "authorized_by_this_proposal": false
        },
        {
          "diagnostic_class": "ASCII_STRUCTURAL_MISMATCH",
          "possible_later_action": "REQUIRE_SEPARATE_SOURCE_FORMAT_OR_AUTHORITY_DIAGNOSTIC_PROPOSAL",
          "authorized_by_this_proposal": false
        }
      ]
    },
    "parser_boundary": {
      "const": {
        "current_custom_projector_remains_unchanged": true,
        "real_row_stdlib_csv_crosscheck_in_scope": false,
        "reason": "A full-row stdlib parser crosscheck would broaden transient exposure beyond the narrow PROPERTY_TYPE projector and therefore requires a separate privacy design if later needed.",
        "existing_synthetic_stdlib_differential_matrix_remains_relevant": true
      }
    },
    "consumed_authorizations": {
      "const": [
        {"approval_ref": "APPROVE_SECOND_PROPERTY_TYPE_SEMANTIC_EXECUTION_BOUNDED", "consumed": true, "reusable": false},
        {"approval_ref": "APPROVE_SECOND_PROPERTY_TYPE_TRANSIENT_ROW_PRIVACY_BOUNDED", "consumed": true, "reusable": false},
        {"approval_ref": "APPROVE_PROPERTY_TYPE_AUTHORITY_ARCHIVAL_EXECUTION_ONE_SHOT", "consumed": true, "reusable": false}
      ]
    },
    "authorization_boundary": {
      "const": {
        "proposal_preparation_authorized": true,
        "diagnostic_execution_authorized": false,
        "transient_row_privacy_exposure_authorized": false,
        "network_workflow_authorized": false,
        "runtime_change_authorized": false,
        "remediation_authorized": false,
        "third_semantic_execution_authorized": false,
        "approval_token_defined_by_this_proposal": false,
        "fresh_execution_and_privacy_approvals_required_after_human_review": true
      }
    },
    "forbidden_actions": {
      "const": {
        "sco_or_claimit_network_access_during_proposal_preparation": true,
        "authority_retrieval": true,
        "third_semantic_execution": true,
        "source_value_reconstruction_or_inference": true,
        "source_value_hashing_or_length_capture": true,
        "runner_change": true,
        "parser_change": true,
        "regex_change": true,
        "regex_relaxation": true,
        "trimming_as_runtime_behavior": true,
        "uppercasing_as_runtime_behavior": true,
        "unicode_normalization": true,
        "logging_expansion": true,
        "persistence_expansion": true,
        "privacy_expansion": true,
        "source_approval": true,
        "registry_activation": true,
        "production_classification_activation": true,
        "identity_resolution": true,
        "genealogy": true,
        "beneficiary_matching": true,
        "outreach": true,
        "claim_submission": true
      }
    },
    "implementation_state": {
      "const": {
        "proposal_branch": "m3-ca-sco-property-type-diagnostic-remediation-evidence-proposal",
        "proposal_only": true,
        "source_request_performed": false,
        "diagnostic_execution_performed": false,
        "network_workflow_created": false,
        "runner_modified": false,
        "parser_modified": false,
        "regex_modified": false,
        "normalization_modified": false,
        "logging_modified": false,
        "persistence_modified": false
      }
    },
    "safety_state": {
      "const": {
        "source_policy_status": "PROPOSED",
        "registry_enabled": false,
        "registry_approved_for_use": false,
        "approved_real_sources": 0,
        "authority_provenance_resolved": true,
        "semantic_compatibility_resolved": false,
        "production_classification_active": false,
        "identity_resolution_allowed": false,
        "genealogy_allowed": false,
        "beneficiary_matching_allowed": false,
        "outreach_allowed": false,
        "claim_submission_allowed": false
      }
    },
    "acceptance_criteria": {
      "const": [
        "PROPOSAL_VALIDATES_AGAINST_VERSIONED_SCHEMA",
        "BASE_PINNED_TO_VERIFIED_AUTHORITY_PROVENANCE_REVIEW_AND_SECOND_EXECUTION_EVIDENCE",
        "PROPOSAL_PREPARATION_PERFORMS_NO_SOURCE_OR_AUTHORITY_NETWORK_ACCESS",
        "FUTURE_DIAGNOSTIC_BOUND_TO_ONE_MEMBER_ONE_RANGE_MAX_FOUR_TRANSIENT_ROWS",
        "FUTURE_DIAGNOSTIC_STOPS_AT_FIRST_REPRODUCED_FORMAT_MISMATCH",
        "NO_EXACT_VALUE_BYTES_HASH_LENGTH_FRAGMENTS_CODEPOINTS_OR_TRANSFORMED_VALUES_PERSISTED",
        "NO_FULL_ROW_RAW_BODY_PROPERTY_ID_OR_OWNER_HOLDER_VALUE_PERSISTENCE",
        "NO_REGEX_PARSER_RUNTIME_NORMALIZATION_LOGGING_OR_PERSISTENCE_CHANGE_BY_THIS_PROPOSAL",
        "NO_AUTOMATIC_REMEDIATION_FROM_ANY_DIAGNOSTIC_CLASS",
        "CONSUMED_APPROVALS_REMAIN_NON_REUSABLE",
        "FRESH_EXECUTION_AND_PRIVACY_APPROVALS_REQUIRED_BEFORE_ANY_DIAGNOSTIC_SOURCE_ACCESS",
        "DOWNSTREAM_GATES_REMAIN_CLOSED"
      ]
    },
    "next_gate": {"const": "HUMAN_PROPERTY_TYPE_DIAGNOSTIC_REMEDIATION_EVIDENCE_PROPOSAL_REVIEW"}
  }
}
